{
  "schemaVersion": "autovideo-material-suitability/v1",
  "projectId": "rag-full-chain-5m-20260728-v1",
  "sourceRegister": {
    "path": "sources.json",
    "sha256": "0f98597e945eccc2a2e71450d56b766235ad04495cb34f2dafde431c1cae3c36"
  },
  "assessmentScope": "technical-baseline",
  "status": "suitable",
  "recommendedRoute": "script",
  "usableSourceIds": [
    "source-001-41d218d3"
  ],
  "preparationActions": [
    {
      "sourceId": "source-001-41d218d3",
      "action": "none",
      "reason": "Text can enter claim extraction directly."
    }
  ],
  "blockers": [],
  "humanReviewRequired": true,
  "rewritePolicy": {
    "allowNewFacts": false,
    "requireClaimMapping": true,
    "preserveApprovedWording": true
  },
  "generatedAt": "2026-07-28T05:41:49.600Z"
}
